<?xml version="1.0" encoding="UTF-8"?>
<!--

    ***************************************************************************
    Copyright (c) 2010 Qcadoo Limited
    Project: Qcadoo Framework
    Version: 1.1.0

    This file is part of Qcadoo.

    Qcadoo is free software; you can redistribute it and/or modify
    it under the terms of the GNU Affero General Public License as published
    by the Free Software Foundation; either version 3 of the License,
    or (at your option) any later version.

    This program is distributed in the hope that it will be useful,
    but WITHOUT ANY WARRANTY; without even the implied warranty
    of MERCHANTABILITY or FITNESS FOR A PARTICULAR PURPOSE.
    See the GNU Affero General Public License for more details.

    You should have received a copy of the GNU Affero General Public License
    along with this program; if not, write to the Free Software
    Foundation, Inc., 51 Franklin St, Fifth Floor, Boston, MA  02110-1301  USA
    ***************************************************************************

-->
<model name="user" xmlns:xsi="http://www.w3.org/2001/XMLSchema-instance"
	xmlns="http://schema.qcadoo.org/model"
	xsi:schemaLocation="http://schema.qcadoo.org/model http://schema.qcadoo.org/model.xsd">
	<fields>
		<string name="userName" required="true" unique="true">
			<validatesRegex pattern="^[a-zA-Z0-9\\.]+$"
				message="qcadooSecurity.validate.global.error.loginIllegalCharacters" />
		</string>
		<enum name="role" values="" required="true"/>
		<string name="email" />
		<string name="firstName" />
		<string name="lastName" />
		<boolean name="enabled" default="true" />
		<string name="description">
			<validatesLength max="255" />
		</string>
		<password name="password" /><!-- TODO validatesPresenceOnCreate -->
		<password name="passwordConfirmation" persistent="false" /><!-- 
			TODO validatesPresenceOnCreate -->
		<password name="oldPassword" persistent="false" />
		<string name="viewIdentifier" persistent="false" />
		<datetime name="lastActivity" />
	</fields>
	<hooks>
		<validatesWith class="com.qcadoo.security.internal.validators.PasswordValidationService"
			method="checkPassword" />
	</hooks>
	<identifier expression="#userName" />
</model>
